{"authorizations":{"calibration_development_run_authorized":false,"dvc_commands_authorized":false,"dvc_push_authorized":false,"e0_m_authorized":false,"e0_u_authorized":false,"e7_learning_curve_run_authorized":false,"effective_in_payload":false,"git_commit_authorized":false,"git_push_authorized":false,"holdout_access_authorized":false,"locked_evaluation_authorized":false,"outcome_access_authorized":false,"post_2021_access_authorized":false,"scientific_network_authorized":false},"calibration_group_matrix":{"bloom_group_count":66,"bloom_group_key":["model_id","model_seed","horizon_months"],"bloom_group_target_universe_policy":"exact_identity_set_equality_no_partial_groups","bloom_groups_with_exact_complete_target_universe":66,"complete_target_count":2646,"complete_target_counts_by_target_year_horizon":{"2019":{"1":397,"2":371,"3":344},"2020":{"1":261,"2":287,"3":314},"2021":{"1":224,"2":224,"3":224}},"complete_target_identity_key":["source_id","site_id","origin_year_month","target_year_month","horizon_months"],"cross_group_pooling":"no_pooling","horizons_months":[1,2,3],"ordinal_completed_group_count":30,"ordinal_group_count":33,"ordinal_group_key":["model_id","model_seed","horizon_months"],"ordinal_unavailable_cutpoints":null,"ordinal_unavailable_group_count":3,"ordinal_unavailable_model_ids":["B0"],"ordinal_unavailable_status":"not_available_degenerate_constant_score","q_c_levels":[0.8,0.9,0.95],"q_c_record_count":90,"uncertainty_group_count":30,"uncertainty_group_key":["model_id","model_seed","horizon_months"],"uncertainty_model_ids":["A0","A1"]},"e7_terminal_record":{"base_seeds":[1729,20260612,20260613,20260614,314159],"checkpoint_or_model_write_count":0,"completed_metric_ids":["expert_anchor_fidelity","membership_stability","deterministic_computational_cost_proxy"],"completed_semantics":"anfis_module_fit_only_not_downstream_ablation","completed_training_rows_per_module":[4096],"computational_cost_proxy":"deterministic_update_count_and_sample_count_no_wall_clock","downstream_blockers":["P0_model_unavailable","P1_model_unavailable"],"downstream_metrics_status":"not_estimable_without_separate_temporal_consumers","e7_fit_identity_key":["experiment_id","training_rows_per_module","base_seed","module_id"],"eligible_rows_by_module":{"ANFIS-F":35273,"ANFIS-N":4757,"ANFIS-T-no-current":35419},"exact_record_per_required_size":true,"expected_completed_module_fit_count":15,"expected_completed_slot_count":5,"expected_preflight_record_count":45,"expected_resource_failure_record_count":10,"expected_slot_count":15,"experiment_id":"E7","expert_anchor_band_boundaries":[0.0,0.3333333333333333,0.6666666666666666,1.0],"expert_anchor_band_labels":["low","middle","high"],"expert_anchor_band_target_scope":"per_target_module","family80_no_touch":true,"historical_blockers_adopted":[{"bytes":46105,"e7_learning_curve_sizes_authorized":"not_declared","e7_learning_curve_status":"blocked_pending_sampling_strata_contract","git_mode":"100644","git_oid":"5970ab73eedb20f464f804a185a3057daba93ab3","path":"configs/closure_v1/development_runtime.yaml","sha256":"0b2588248ee006f7d8e8843291b6a5847201a36fed35422473c9c0aa9492b10d"},{"bytes":22694,"e7_learning_curve_sizes_authorized":"not_declared","e7_learning_curve_status":"blocked_for_separate_gate","git_mode":"100644","git_oid":"94f84be4346fd4e01fd52d207b932e21022fc436","path":"configs/closure_v1/anfis_ablation_training_development_runtime.yaml","sha256":"cf2cec52d9027db895e8859c7ffb321c831b66510132e137759e567b363f6a50"},{"bytes":21827,"e7_learning_curve_sizes_authorized":false,"e7_learning_curve_status":"blocked_for_separate_gate","git_mode":"100644","git_oid":"f9956fb51a8b0a742831c3400cc9624f4369fe90","path":"configs/closure_v1/anfis_ablation_sequence_development_runtime.yaml","sha256":"49d1a3f562f2cd68ff65f29c92ac4e028b3ad407f30a9960ea0d29260df7d56b"}],"historical_e7_blocker_adopted":true,"holdout_group_id_derivation":"source_id_double_colon_site_id_verified_against_assignment","new_e7_fit_count":15,"preflight_module_count_per_slot":3,"prelock_status":"pending_authorized_terminalization","primary_4096_hash_rank_reuse_forbidden":true,"primary_fit_reuse_count":0,"primary_fit_scope":"hash_rank_not_reused","required_training_rows_per_module":[4096,16384,65536],"resource_failure_timing":"pre_fit_exact_eligibility_check","resource_failure_training_rows_per_module":[16384,65536],"retain_completed_sizes_without_post_hoc_substitution":true,"sampling_strata":["holdout_group_id","temporal_period","expert_anchor_band"],"saturation_claim_authorized_if_incomplete":false,"silent_omission_allowed":false,"stratum_derivation_evidence":"boundaries_maps_and_sha256_digests_required","supersession_scope":"e7_only_additive_authority","temporal_period_derivation":"ordered_unique_eligible_month_index_floor_3i_over_n","temporal_period_labels":["early","middle","late"],"temporal_period_target_scope":"per_target_module_after_eligibility_filter","terminal_statuses":["completed","resource_failure_recorded"],"wall_clock_metric_authoritative":false},"experiment_id":"closure_v1","failed_attempt":{"active_guard_count":0,"anfis_inference_slot_count":10,"attempted_gate":"E0-MCALF","authorization_consumed":true,"bundle_payload_built":false,"calibration_fit_performed":false,"dvc_commands_run":false,"failure_code":"ordinal_label_nullable_integer_representation_drift","filesystem_side_effect_count":0,"final_output_count":0,"holdout_rows_opened":false,"model_inference_performed":true,"outcome_paths_opened":false,"phase":"normalized_calibration_frame_validation","post_2021_rows_opened":false,"retry_authorized":false,"scientific_input_reads_performed":true,"status":"failed_closed_no_outputs","temporary_output_count":0},"gate":"E0-MCALG","generated_at_utc":"2026-08-11T20:12:51.409368+00:00","h_patch":{"added_count":5,"component_count":9,"components":[{"bytes":13227,"git_mode":"100644","git_oid":"1bd7b8601dc5c19729f8ad2215ca5f6395e60cf6","path":"configs/closure_v1/final_calibration_ordinal_label_representation_patch_lock.schema.json","role":"final_calibration_ordinal_label_representation_patch_component","sha256":"d5ef5c98e40a35775cce3c8bf08ed8f2313657b205765c5d1a2642312132971d"},{"bytes":8773,"git_mode":"100644","git_oid":"7d700e34d2aba1a8c61a4798e1787c469b8defda","path":"docs/closure_v1/E0_M_FINAL_CALIBRATION_ORDINAL_LABEL_REPRESENTATION_PATCH_1.md","role":"final_calibration_ordinal_label_representation_patch_component","sha256":"000d9cedc31239978c16646cd3e731bf065a0a0951d0e0bb67c5a8de4f042618"},{"bytes":162000,"git_mode":"100644","git_oid":"316da3f6da19bd5f2246474df90bf29b8ce7279e","path":"src/experiments/calibrate_closure_final_models.py","role":"final_calibration_ordinal_label_representation_patch_component","sha256":"80c772d830895f6b8d5117c5c5fa2b31ba3688b5a0c8a2196a204bf42da8c735"},{"bytes":87231,"git_mode":"100644","git_oid":"37cdd0004fce8f607aa15338b98e2258a8973196","path":"src/experiments/closure_final_calibration_ordinal_label_representation_patch.py","role":"final_calibration_ordinal_label_representation_patch_component","sha256":"5da7278878c4dcfc2d2a6f1510a46fb4e06c4be2312858acd784be77f660c1aa"},{"bytes":9174,"git_mode":"100644","git_oid":"64866914d5e72933f2f1196244ed505341ffe0ec","path":"src/experiments/lock_closure_final_calibration_ordinal_label_representation_patch.py","role":"final_calibration_ordinal_label_representation_patch_component","sha256":"d0bc095b96dae2587263f679f0d1427913c9fba2f98eabfa887973f97d8aa6e5"},{"bytes":78298,"git_mode":"100644","git_oid":"3d62631bbb298995d97767af74da01fe5089f391","path":"src/experiments/run_closure_anfis_learning_curve.py","role":"final_calibration_ordinal_label_representation_patch_component","sha256":"b1b7a0219d2b6c3406d4944b14a90634af1c863045e3b60e02d4a0636fae7ad2"},{"bytes":97348,"git_mode":"100644","git_oid":"1149e4ebc6888331837c39cdc017a36fb2b4a821","path":"tests/test_calibrate_closure_final_models.py","role":"final_calibration_ordinal_label_representation_patch_component","sha256":"3c1a9a4a06730304c7e1ed0b66ca72b7cc9cf9d6512661b15c1a4365bfdaf112"},{"bytes":61611,"git_mode":"100644","git_oid":"67dff3a2cd89c20a0a0a630a3dbc994f6a319628","path":"tests/test_closure_anfis_learning_curve.py","role":"final_calibration_ordinal_label_representation_patch_component","sha256":"0357fadb2ca76342cf07f0218b1e61f3dd42f8a0b9b7076c1a0422d630b953ae"},{"bytes":44030,"git_mode":"100644","git_oid":"ff2b28722cd365a77a5cd34ef146cc0947686982","path":"tests/test_closure_final_calibration_ordinal_label_representation_patch.py","role":"final_calibration_ordinal_label_representation_patch_component","sha256":"747e9e23cb691c7af2a982a1c49eff0453aaef8b5e151205c732387533a22a35"}],"components_sha256":"987f4f12bc60dfb6fc0dc1fc9ffdce93d3350e8a2f5d4896a97bbc18528376df","gate":"H-E0-MCALG","modified_count":4},"model_matrix":{"available_calibrable_count":6,"available_not_applicable_count":2,"model_count":11,"ordered_model_ids":["B0","B1","B2","F0","F1","P0","P1","M0","A0","A1","A2"],"records":[{"availability":"available","availability_reason":"published_deterministic_baseline","bloom_calibration":"fixed_identity_no_refit","bloom_score_source":"predicted_bloom_probability","calibration_seed_source":"technical_seed","horizons_months":[1,2,3],"model_id":"B0","ordinal_calibration":"record_not_available_degenerate_constant_score","seed_policy":"deterministic_technical_seed","seeds":[1729],"selected_family":false,"uncertainty_calibration":"not_applicable"},{"availability":"available","availability_reason":"published_seeded_baseline_family","bloom_calibration":"select_then_refit","bloom_score_source":"predicted_bloom_probability","calibration_seed_source":"upstream_state_seed","horizons_months":[1,2,3],"model_id":"B1","ordinal_calibration":"select_cutpoints","seed_policy":"exact_five_prespecified_seeds","seeds":[1729,20260612,20260613,20260614,314159],"selected_family":false,"uncertainty_calibration":"not_applicable"},{"availability":"available","availability_reason":"published_seeded_baseline_family","bloom_calibration":